{
  "$schema": "https://json-schema.org/draft/2020-12/schema",
  "$id": "https://relaymind.local/schemas/asset_qualification_record.v1.json",
  "title": "QualificationRecordV1 (spec 0.66 section 12.6.6)",
  "type": "object",
  "additionalProperties": false,
  "required": [
    "schema_version",
    "record_id",
    "profile",
    "outcome",
    "scope",
    "labelling",
    "annotators",
    "agreement",
    "prompt_authorship",
    "drafter",
    "corpus_review",
    "preregistration",
    "runs_started_at",
    "machine",
    "revisions",
    "operation",
    "subjects",
    "review",
    "recorded_at"
  ],
  "properties": {
    "schema_version": {
      "const": 1
    },
    "record_id": {
      "type": "string",
      "minLength": 1,
      "maxLength": 256,
      "x-maxBytes": 256
    },
    "profile": {
      "const": "owner_run"
    },
    "outcome": {
      "enum": [
        "positive",
        "negative"
      ]
    },
    "scope": {
      "enum": [
        "host_trial",
        "host_acceptance",
        "adaptation",
        "platform",
        "walkthrough",
        "host_operation"
      ]
    },
    "labelling": {
      "enum": [
        "owner_machine",
        "machine_dual_owner_approved",
        "independent",
        "not_applicable"
      ]
    },
    "annotators": {
      "anyOf": [
        {
          "type": "object",
          "additionalProperties": false,
          "required": [
            "owner_annotator_id",
            "machine"
          ],
          "properties": {
            "owner_annotator_id": {
              "type": "string",
              "minLength": 1,
              "maxLength": 256,
              "x-maxBytes": 256
            },
            "machine": {
              "type": "object",
              "additionalProperties": false,
              "required": [
                "annotator_id",
                "model_id",
                "prompt_sha256",
                "temperature",
                "saw_tuning_results",
                "saw_arm_outputs"
              ],
              "properties": {
                "annotator_id": {
                  "type": "string",
                  "minLength": 1,
                  "maxLength": 256,
                  "x-maxBytes": 256
                },
                "model_id": {
                  "type": "string",
                  "minLength": 1,
                  "maxLength": 256,
                  "x-maxBytes": 256
                },
                "prompt_sha256": {
                  "type": "string",
                  "pattern": "^[0-9a-f]{64}$(?![\\s\\S])"
                },
                "temperature": {
                  "const": 0
                },
                "saw_tuning_results": {
                  "const": false
                },
                "saw_arm_outputs": {
                  "const": false
                }
              }
            }
          }
        },
        {
          "type": "object",
          "additionalProperties": false,
          "required": [
            "machine_a",
            "machine_b",
            "adjudicator",
            "family_relation"
          ],
          "properties": {
            "machine_a": {
              "type": "object",
              "additionalProperties": false,
              "required": [
                "annotator_id",
                "model_id",
                "prompt_sha256",
                "temperature",
                "saw_tuning_results",
                "saw_arm_outputs"
              ],
              "properties": {
                "annotator_id": {
                  "type": "string",
                  "minLength": 1,
                  "maxLength": 256,
                  "x-maxBytes": 256
                },
                "model_id": {
                  "type": "string",
                  "minLength": 1,
                  "maxLength": 256,
                  "x-maxBytes": 256
                },
                "prompt_sha256": {
                  "type": "string",
                  "pattern": "^[0-9a-f]{64}$(?![\\s\\S])"
                },
                "temperature": {
                  "const": 0
                },
                "saw_tuning_results": {
                  "const": false
                },
                "saw_arm_outputs": {
                  "const": false
                }
              }
            },
            "machine_b": {
              "type": "object",
              "additionalProperties": false,
              "required": [
                "annotator_id",
                "model_id",
                "prompt_sha256",
                "temperature",
                "saw_tuning_results",
                "saw_arm_outputs"
              ],
              "properties": {
                "annotator_id": {
                  "type": "string",
                  "minLength": 1,
                  "maxLength": 256,
                  "x-maxBytes": 256
                },
                "model_id": {
                  "type": "string",
                  "minLength": 1,
                  "maxLength": 256,
                  "x-maxBytes": 256
                },
                "prompt_sha256": {
                  "type": "string",
                  "pattern": "^[0-9a-f]{64}$(?![\\s\\S])"
                },
                "temperature": {
                  "const": 0
                },
                "saw_tuning_results": {
                  "const": false
                },
                "saw_arm_outputs": {
                  "const": false
                }
              }
            },
            "adjudicator": {
              "type": "object",
              "additionalProperties": false,
              "required": [
                "annotator_id",
                "model_id",
                "prompt_sha256",
                "temperature",
                "saw_tuning_results",
                "saw_arm_outputs"
              ],
              "properties": {
                "annotator_id": {
                  "type": "string",
                  "minLength": 1,
                  "maxLength": 256,
                  "x-maxBytes": 256
                },
                "model_id": {
                  "type": "string",
                  "minLength": 1,
                  "maxLength": 256,
                  "x-maxBytes": 256
                },
                "prompt_sha256": {
                  "type": "string",
                  "pattern": "^[0-9a-f]{64}$(?![\\s\\S])"
                },
                "temperature": {
                  "const": 0
                },
                "saw_tuning_results": {
                  "const": false
                },
                "saw_arm_outputs": {
                  "const": false
                }
              }
            },
            "family_relation": {
              "enum": [
                "different_family",
                "same_family"
              ]
            }
          }
        },
        {
          "type": "null"
        }
      ]
    },
    "agreement": {
      "anyOf": [
        {
          "type": "object",
          "additionalProperties": false,
          "required": [
            "paired_cases",
            "class_agreements",
            "cohen_kappa"
          ],
          "properties": {
            "paired_cases": {
              "type": "integer",
              "minimum": 0
            },
            "class_agreements": {
              "type": "integer",
              "minimum": 0
            },
            "cohen_kappa": {
              "anyOf": [
                {
                  "type": "number",
                  "minimum": -1,
                  "maximum": 1
                },
                {
                  "type": "null"
                }
              ]
            }
          }
        },
        {
          "type": "null"
        }
      ]
    },
    "prompt_authorship": {
      "enum": [
        "original",
        "machine_drafted_owner_approved",
        "not_applicable"
      ]
    },
    "drafter": {
      "anyOf": [
        {
          "type": "object",
          "additionalProperties": false,
          "required": [
            "author_id",
            "model_id",
            "prompt_sha256",
            "temperature"
          ],
          "properties": {
            "author_id": {
              "type": "string",
              "minLength": 1,
              "maxLength": 256,
              "x-maxBytes": 256
            },
            "model_id": {
              "type": "string",
              "minLength": 1,
              "maxLength": 256,
              "x-maxBytes": 256
            },
            "prompt_sha256": {
              "type": "string",
              "pattern": "^[0-9a-f]{64}$(?![\\s\\S])"
            },
            "temperature": {
              "const": 0
            }
          }
        },
        {
          "type": "null"
        }
      ]
    },
    "corpus_review": {
      "anyOf": [
        {
          "type": "object",
          "additionalProperties": false,
          "required": [
            "lock_digest",
            "custodian_id",
            "review_record_evidence_ids",
            "reviewed_evidence"
          ],
          "properties": {
            "lock_digest": {
              "type": "string",
              "pattern": "^[0-9a-f]{64}$(?![\\s\\S])"
            },
            "custodian_id": {
              "type": "string",
              "minLength": 1,
              "maxLength": 256,
              "x-maxBytes": 256
            },
            "review_record_evidence_ids": {
              "type": "array",
              "items": {
                "type": "string",
                "minLength": 1,
                "maxLength": 256,
                "x-maxBytes": 256
              },
              "minItems": 1,
              "uniqueItems": true,
              "x-sorted": true,
              "maxItems": 10000
            },
            "reviewed_evidence": {
              "type": "array",
              "maxItems": 10000,
              "items": {
                "type": "object",
                "additionalProperties": false,
                "required": [
                  "evidence_id",
                  "domains"
                ],
                "properties": {
                  "evidence_id": {
                    "type": "string",
                    "minLength": 1,
                    "maxLength": 256,
                    "x-maxBytes": 256
                  },
                  "domains": {
                    "type": "array",
                    "items": {
                      "type": "string",
                      "minLength": 1,
                      "maxLength": 256,
                      "x-maxBytes": 256
                    },
                    "minItems": 1,
                    "uniqueItems": true,
                    "x-sorted": true,
                    "maxItems": 64
                  }
                }
              }
            }
          }
        },
        {
          "type": "null"
        }
      ]
    },
    "preregistration": {
      "anyOf": [
        {
          "type": "object",
          "additionalProperties": false,
          "required": [
            "commit",
            "committed_at"
          ],
          "properties": {
            "commit": {
              "type": "string",
              "pattern": "^[0-9a-f]{40}$(?![\\s\\S])"
            },
            "committed_at": {
              "type": "string",
              "pattern": "^\\d{4}-\\d{2}-\\d{2}T\\d{2}:\\d{2}:\\d{2}(?:\\.\\d+)?Z$(?![\\s\\S])"
            }
          }
        },
        {
          "type": "null"
        }
      ]
    },
    "runs_started_at": {
      "anyOf": [
        {
          "type": "string",
          "pattern": "^\\d{4}-\\d{2}-\\d{2}T\\d{2}:\\d{2}:\\d{2}(?:\\.\\d+)?Z$(?![\\s\\S])"
        },
        {
          "type": "null"
        }
      ]
    },
    "machine": {
      "anyOf": [
        {
          "type": "object",
          "additionalProperties": false,
          "required": [
            "role",
            "os",
            "os_build",
            "os_version",
            "architecture",
            "cpu_model",
            "ram_bytes",
            "hostname_sha256"
          ],
          "properties": {
            "role": {
              "enum": [
                "target_macos_m1_8gib",
                "target_windows_x64",
                "linux_host"
              ]
            },
            "os": {
              "enum": [
                "Darwin",
                "Windows",
                "Linux"
              ]
            },
            "os_build": {
              "type": "string",
              "minLength": 1,
              "maxLength": 256,
              "x-maxBytes": 256
            },
            "os_version": {
              "type": "string",
              "minLength": 1,
              "maxLength": 256,
              "x-maxBytes": 256
            },
            "architecture": {
              "type": "string",
              "minLength": 1,
              "maxLength": 256,
              "x-maxBytes": 256
            },
            "cpu_model": {
              "type": "string",
              "minLength": 1,
              "maxLength": 256,
              "x-maxBytes": 256
            },
            "ram_bytes": {
              "type": "integer",
              "minimum": 1
            },
            "hostname_sha256": {
              "type": "string",
              "pattern": "^[0-9a-f]{64}$(?![\\s\\S])"
            }
          }
        },
        {
          "type": "null"
        }
      ]
    },
    "revisions": {
      "type": "object",
      "additionalProperties": false,
      "required": [
        "repository_commit",
        "adapter_revision",
        "harness_sha256"
      ],
      "properties": {
        "repository_commit": {
          "type": "string",
          "pattern": "^[0-9a-f]{40}$(?![\\s\\S])"
        },
        "adapter_revision": {
          "anyOf": [
            {
              "type": "string",
              "minLength": 1,
              "maxLength": 256,
              "x-maxBytes": 256
            },
            {
              "type": "null"
            }
          ]
        },
        "harness_sha256": {
          "anyOf": [
            {
              "type": "string",
              "pattern": "^[0-9a-f]{64}$(?![\\s\\S])"
            },
            {
              "type": "null"
            }
          ]
        }
      }
    },
    "operation": {
      "anyOf": [
        {
          "type": "object",
          "additionalProperties": false,
          "required": [
            "name",
            "host",
            "host_version",
            "finding",
            "disabled"
          ],
          "properties": {
            "name": {
              "enum": [
                "skill_loaded_use",
                "mcp_use"
              ]
            },
            "host": {
              "type": "string",
              "minLength": 1,
              "maxLength": 256,
              "x-maxBytes": 256
            },
            "host_version": {
              "type": "string",
              "minLength": 1,
              "maxLength": 256,
              "x-maxBytes": 256
            },
            "finding": {
              "enum": [
                "qualified",
                "stop_point_absent",
                "exact_route_absent"
              ]
            },
            "disabled": {
              "type": "boolean"
            }
          }
        },
        {
          "type": "null"
        }
      ]
    },
    "subjects": {
      "type": "array",
      "minItems": 1,
      "maxItems": 10000,
      "items": {
        "type": "object",
        "additionalProperties": false,
        "required": [
          "role",
          "path",
          "sha256",
          "bytes"
        ],
        "properties": {
          "role": {
            "enum": [
              "report",
              "freeze",
              "tasks",
              "episodes",
              "corpus_lock",
              "labels",
              "environment",
              "inventory",
              "capture",
              "media",
              "evidence"
            ]
          },
          "path": {
            "type": "string",
            "minLength": 1,
            "maxLength": 2048,
            "x-maxBytes": 2048,
            "x-relative": true
          },
          "sha256": {
            "type": "string",
            "pattern": "^[0-9a-f]{64}$(?![\\s\\S])"
          },
          "bytes": {
            "type": "integer",
            "minimum": 0
          }
        }
      }
    },
    "review": {
      "type": "object",
      "additionalProperties": false,
      "required": [
        "owner_login",
        "pull_request",
        "reviewer_logins",
        "approved_at"
      ],
      "properties": {
        "owner_login": {
          "type": "string",
          "minLength": 1,
          "maxLength": 256,
          "x-maxBytes": 256
        },
        "pull_request": {
          "anyOf": [
            {
              "type": "integer",
              "minimum": 1
            },
            {
              "type": "null"
            }
          ]
        },
        "reviewer_logins": {
          "type": "array",
          "items": {
            "type": "string",
            "minLength": 1,
            "maxLength": 256,
            "x-maxBytes": 256
          },
          "uniqueItems": true,
          "x-sorted": true,
          "maxItems": 64
        },
        "approved_at": {
          "anyOf": [
            {
              "type": "string",
              "pattern": "^\\d{4}-\\d{2}-\\d{2}T\\d{2}:\\d{2}:\\d{2}(?:\\.\\d+)?Z$(?![\\s\\S])"
            },
            {
              "type": "null"
            }
          ]
        }
      }
    },
    "recorded_at": {
      "type": "string",
      "pattern": "^\\d{4}-\\d{2}-\\d{2}T\\d{2}:\\d{2}:\\d{2}(?:\\.\\d+)?Z$(?![\\s\\S])"
    }
  }
}
